{
    "system": "Tetraeder Geometrie",
    "metadata": {
        "created": "2025-11-25T15:32:00Z",
        "version": "2.0",
        "author": "Nodges Team",
        "description": "Ein Tetraeder (4-Flächner) - der einfachste platonische Körper mit 4 Vertices und 6 Kanten"
    },
    "dataModel": {
        "entities": {
            "vertex": {
                "properties": {
                    "position": {
                        "type": "spatial",
                        "coordinates": [
                            "x",
                            "y",
                            "z"
                        ]
                    },
                    "group": {
                        "type": "categorical",
                        "values": [
                            "tetraeder"
                        ]
                    }
                }
            }
        },
        "relationships": {
            "edge": {
                "properties": {}
            }
        }
    },
    "visualMappings": {
        "defaultPresets": {
            "vertex": {
                "size": {
                    "source": "constant",
                    "function": "linear",
                    "range": [
                        0.8,
                        0.8
                    ]
                },
                "color": {
                    "source": "constant",
                    "function": "linear"
                },
                "geometry": {
                    "source": "constant",
                    "function": "geographic"
                }
            },
            "edge": {
                "thickness": {
                    "source": "constant",
                    "function": "linear",
                    "range": [
                        0.08,
                        0.08
                    ]
                },
                "color": {
                    "source": "constant",
                    "function": "linear"
                }
            }
        }
    },
    "data": {
        "entities": [
            {
                "id": "v0",
                "type": "vertex",
                "label": "Vertex 0 (Top)",
                "position": {
                    "x": 0,
                    "y": 2.5,
                    "z": 0
                },
                "group": "tetraeder"
            },
            {
                "id": "v1",
                "type": "vertex",
                "label": "Vertex 1 (Base)",
                "position": {
                    "x": 2.357,
                    "y": -0.833,
                    "z": 0
                },
                "group": "tetraeder"
            },
            {
                "id": "v2",
                "type": "vertex",
                "label": "Vertex 2 (Base)",
                "position": {
                    "x": -1.178,
                    "y": -0.833,
                    "z": 2.041
                },
                "group": "tetraeder"
            },
            {
                "id": "v3",
                "type": "vertex",
                "label": "Vertex 3 (Base)",
                "position": {
                    "x": -1.178,
                    "y": -0.833,
                    "z": -2.041
                },
                "group": "tetraeder"
            }
        ],
        "relationships": [
            {
                "id": "e0-1",
                "type": "edge",
                "source": "v0",
                "target": "v1",
                "label": "Kante 0-1"
            },
            {
                "id": "e0-2",
                "type": "edge",
                "source": "v0",
                "target": "v2",
                "label": "Kante 0-2"
            },
            {
                "id": "e0-3",
                "type": "edge",
                "source": "v0",
                "target": "v3",
                "label": "Kante 0-3"
            },
            {
                "id": "e1-2",
                "type": "edge",
                "source": "v1",
                "target": "v2",
                "label": "Kante 1-2"
            },
            {
                "id": "e1-3",
                "type": "edge",
                "source": "v1",
                "target": "v3",
                "label": "Kante 1-3"
            },
            {
                "id": "e2-3",
                "type": "edge",
                "source": "v2",
                "target": "v3",
                "label": "Kante 2-3"
            }
        ]
    }
}