{
  "system": "Medium Graph Structure",
  "metadata": {
    "created": "2025-11-25T14:36:00Z",
    "version": "2.0",
    "author": "Nodges Team",
    "description": "Ein mittelgroßer Graph mit 12 Knoten in einer Würfel-artigen Struktur"
  },
  "dataModel": {
    "entities": {
      "vertex": {
        "properties": {
          "position": {
            "type": "spatial",
            "coordinates": [
              "x",
              "y",
              "z"
            ]
          }
        }
      }
    },
    "relationships": {
      "edge": {
        "properties": {
          "offset": {
            "type": "continuous",
            "range": [
              0,
              2
            ],
            "unit": "distance"
          }
        }
      }
    }
  },
  "visualMappings": {
    "defaultPresets": {
      "vertex": {
        "size": {
          "source": "constant",
          "function": "linear",
          "range": [
            0.8,
            0.8
          ]
        },
        "color": {
          "source": "constant",
          "function": "linear"
        }
      },
      "edge": {
        "thickness": {
          "source": "constant",
          "function": "linear",
          "range": [
            0.08,
            0.08
          ]
        }
      }
    }
  },
  "data": {
    "entities": [
      {
        "id": "v0",
        "type": "vertex",
        "label": "Vertex 0",
        "position": {
          "x": -4.2,
          "y": -0.3,
          "z": -3.8
        }
      },
      {
        "id": "v1",
        "type": "vertex",
        "label": "Vertex 1",
        "position": {
          "x": 3.8,
          "y": 0.2,
          "z": -4.2
        }
      },
      {
        "id": "v2",
        "type": "vertex",
        "label": "Vertex 2",
        "position": {
          "x": 4.3,
          "y": -0.4,
          "z": 3.7
        }
      },
      {
        "id": "v3",
        "type": "vertex",
        "label": "Vertex 3",
        "position": {
          "x": -3.7,
          "y": 0.3,
          "z": 4.2
        }
      },
      {
        "id": "v4",
        "type": "vertex",
        "label": "Vertex 4",
        "position": {
          "x": -2.3,
          "y": 2.4,
          "z": -1.8
        }
      },
      {
        "id": "v5",
        "type": "vertex",
        "label": "Vertex 5",
        "position": {
          "x": 1.8,
          "y": 1.8,
          "z": -2.3
        }
      },
      {
        "id": "v6",
        "type": "vertex",
        "label": "Vertex 6",
        "position": {
          "x": 2.2,
          "y": 2.1,
          "z": 1.9
        }
      },
      {
        "id": "v7",
        "type": "vertex",
        "label": "Vertex 7",
        "position": {
          "x": -1.9,
          "y": 2.2,
          "z": 2.3
        }
      },
      {
        "id": "v8",
        "type": "vertex",
        "label": "Vertex 8",
        "position": {
          "x": 0.3,
          "y": 4.2,
          "z": -0.2
        }
      },
      {
        "id": "v9",
        "type": "vertex",
        "label": "Vertex 9",
        "position": {
          "x": -3.2,
          "y": 0.8,
          "z": 0.3
        }
      },
      {
        "id": "v10",
        "type": "vertex",
        "label": "Vertex 10",
        "position": {
          "x": 2.8,
          "y": 1.2,
          "z": -0.2
        }
      },
      {
        "id": "v11",
        "type": "vertex",
        "label": "Vertex 11",
        "position": {
          "x": 0.2,
          "y": 1.3,
          "z": 2.8
        }
      }
    ],
    "relationships": [
      {
        "id": "e0-1",
        "type": "edge",
        "source": "v0",
        "target": "v1",
        "offset": 0
      },
      {
        "id": "e1-2",
        "type": "edge",
        "source": "v1",
        "target": "v2",
        "offset": 0
      },
      {
        "id": "e2-3",
        "type": "edge",
        "source": "v2",
        "target": "v3",
        "offset": 0
      },
      {
        "id": "e3-0",
        "type": "edge",
        "source": "v3",
        "target": "v0",
        "offset": 0
      },
      {
        "id": "e4-5",
        "type": "edge",
        "source": "v4",
        "target": "v5",
        "offset": 0
      },
      {
        "id": "e5-6",
        "type": "edge",
        "source": "v5",
        "target": "v6",
        "offset": 0
      },
      {
        "id": "e6-7",
        "type": "edge",
        "source": "v6",
        "target": "v7",
        "offset": 0
      },
      {
        "id": "e7-4",
        "type": "edge",
        "source": "v7",
        "target": "v4",
        "offset": 0
      },
      {
        "id": "e0-4",
        "type": "edge",
        "source": "v0",
        "target": "v4",
        "offset": 0
      },
      {
        "id": "e1-5",
        "type": "edge",
        "source": "v1",
        "target": "v5",
        "offset": 0
      },
      {
        "id": "e2-6",
        "type": "edge",
        "source": "v2",
        "target": "v6",
        "offset": 0
      },
      {
        "id": "e3-7",
        "type": "edge",
        "source": "v3",
        "target": "v7",
        "offset": 0
      },
      {
        "id": "e8-4",
        "type": "edge",
        "source": "v8",
        "target": "v4",
        "offset": 1
      },
      {
        "id": "e8-5",
        "type": "edge",
        "source": "v8",
        "target": "v5",
        "offset": 1
      },
      {
        "id": "e8-6",
        "type": "edge",
        "source": "v8",
        "target": "v6",
        "offset": 1
      },
      {
        "id": "e8-7",
        "type": "edge",
        "source": "v8",
        "target": "v7",
        "offset": 1
      },
      {
        "id": "e9-10",
        "type": "edge",
        "source": "v9",
        "target": "v10",
        "offset": 0
      },
      {
        "id": "e10-11",
        "type": "edge",
        "source": "v10",
        "target": "v11",
        "offset": 0
      },
      {
        "id": "e11-9",
        "type": "edge",
        "source": "v11",
        "target": "v9",
        "offset": 0
      },
      {
        "id": "e8-11",
        "type": "edge",
        "source": "v8",
        "target": "v11",
        "offset": 1
      }
    ]
  }
}